{
  "$schema": "https://json-schema.org/draft/2020-12/schema",
  "$id": "third-party-artifact-baseline.schema.json",
  "title": "ThirdPartyArtifactBaseline",
  "type": "object",
  "required": ["schema_version", "kind", "artifact_id", "pack_version", "source_lock_sha256", "measurements"],
  "properties": {
    "schema_version": { "type": "integer", "const": 1 },
    "kind": { "type": "string", "const": "third_party_artifact_baseline" },
    "artifact_id": { "type": "string", "const": "rust-analyzer" },
    "pack_version": { "type": "string", "const": "2026.07.27-pcr.2" },
    "source_lock_sha256": {
      "type": "string",
      "const": "38f5f8ea4f9cbec56d8dabb0ac4b992234ae069f76e7cfdeb46388017b3b22c5"
    },
    "measurements": {
      "type": "array",
      "minItems": 1,
      "maxItems": 64,
      "items": { "$ref": "#/$defs/measurement" }
    }
  },
  "$defs": {
    "measurement": {
      "type": "object",
      "required": [
        "platform_id", "pack_sha256", "executable_sha256", "profile_sha256", "fixture_id",
        "fixture_sha256", "request_sha256", "runner_class", "samples_ms", "p95_ms",
        "peak_process_tree_rss_bytes"
      ],
      "properties": {
        "platform_id": { "$ref": "third-party-artifacts.schema.json#/$defs/platformId" },
        "pack_sha256": { "$ref": "third-party-artifacts.schema.json#/$defs/sha256" },
        "executable_sha256": { "$ref": "third-party-artifacts.schema.json#/$defs/sha256" },
        "profile_sha256": { "$ref": "third-party-artifacts.schema.json#/$defs/sha256" },
        "fixture_id": { "$ref": "third-party-artifacts.schema.json#/$defs/identifier" },
        "fixture_sha256": { "$ref": "third-party-artifacts.schema.json#/$defs/sha256" },
        "request_sha256": { "$ref": "third-party-artifacts.schema.json#/$defs/sha256" },
        "runner_class": { "$ref": "third-party-artifacts.schema.json#/$defs/identifier" },
        "samples_ms": {
          "type": "array",
          "minItems": 20,
          "maxItems": 100,
          "items": { "type": "integer", "minimum": 1, "maximum": 30000 }
        },
        "p95_ms": { "type": "integer", "minimum": 1, "maximum": 30000 },
        "peak_process_tree_rss_bytes": { "type": "integer", "minimum": 1, "maximum": 2147483648 }
      },
      "additionalProperties": false
    }
  },
  "additionalProperties": false
}
