{"schema_version":1,"kind":"third_party_artifact_baseline","artifact_id":"rust-analyzer","pack_version":"2026.07.27-pcr.2","source_lock_sha256":"38f5f8ea4f9cbec56d8dabb0ac4b992234ae069f76e7cfdeb46388017b3b22c5","measurements":[{"platform_id":"darwin-amd64","pack_sha256":"1111111111111111111111111111111111111111111111111111111111111111","executable_sha256":"01ed4388725ef878a8682ab086749b8c9f3dfa76cf9ac9a7b173add6075236b3","profile_sha256":"dddddddddddddddddddddddddddddddddddddddddddddddddddddddddddddddd","fixture_id":"single-crate","fixture_sha256":"eeeeeeeeeeeeeeeeeeeeeeeeeeeeeeeeeeeeeeeeeeeeeeeeeeeeeeeeeeeeeeee","request_sha256":"ffffffffffffffffffffffffffffffffffffffffffffffffffffffffffffffff","runner_class":"github-hosted-macos-15-intel","samples_ms":[1001,1002,1003,1004,1005,1006,1007,1008,1009,1010,1011,1012,1013,1014,1015,1016,1017,1018,1019,1020],"p95_ms":1019,"peak_process_tree_rss_bytes":268435456},{"platform_id":"darwin-arm64","pack_sha256":"2222222222222222222222222222222222222222222222222222222222222222","executable_sha256":"c4e9a82238092144191799a0631d21927ea75b8cbf245f79b51d1e89ca9fd760","profile_sha256":"dddddddddddddddddddddddddddddddddddddddddddddddddddddddddddddddd","fixture_id":"single-crate","fixture_sha256":"eeeeeeeeeeeeeeeeeeeeeeeeeeeeeeeeeeeeeeeeeeeeeeeeeeeeeeeeeeeeeeee","request_sha256":"ffffffffffffffffffffffffffffffffffffffffffffffffffffffffffffffff","runner_class":"github-hosted-macos-14-arm64","samples_ms":[1001,1002,1003,1004,1005,1006,1007,1008,1009,1010,1011,1012,1013,1014,1015,1016,1017,1018,1019,1020],"p95_ms":1019,"peak_process_tree_rss_bytes":268435456},{"platform_id":"linux-amd64","pack_sha256":"3333333333333333333333333333333333333333333333333333333333333333","executable_sha256":"f06d56b784d621794290826d28f30345029122f86fb2223d7dda820de8dc8de6","profile_sha256":"dddddddddddddddddddddddddddddddddddddddddddddddddddddddddddddddd","fixture_id":"single-crate","fixture_sha256":"eeeeeeeeeeeeeeeeeeeeeeeeeeeeeeeeeeeeeeeeeeeeeeeeeeeeeeeeeeeeeeee","request_sha256":"ffffffffffffffffffffffffffffffffffffffffffffffffffffffffffffffff","runner_class":"github-hosted-ubuntu-24-x64","samples_ms":[1001,1002,1003,1004,1005,1006,1007,1008,1009,1010,1011,1012,1013,1014,1015,1016,1017,1018,1019,1020],"p95_ms":1019,"peak_process_tree_rss_bytes":268435456},{"platform_id":"windows-amd64","pack_sha256":"4444444444444444444444444444444444444444444444444444444444444444","executable_sha256":"61ad88c3c90a5dece93f590aa31407f69be96023a2536a4f0285bd3def9cb278","profile_sha256":"dddddddddddddddddddddddddddddddddddddddddddddddddddddddddddddddd","fixture_id":"single-crate","fixture_sha256":"eeeeeeeeeeeeeeeeeeeeeeeeeeeeeeeeeeeeeeeeeeeeeeeeeeeeeeeeeeeeeeee","request_sha256":"ffffffffffffffffffffffffffffffffffffffffffffffffffffffffffffffff","runner_class":"github-hosted-windows-2025-x64","samples_ms":[1001,1002,1003,1004,1005,1006,1007,1008,1009,1010,1011,1012,1013,1014,1015,1016,1017,1018,1019,1020],"p95_ms":1019,"peak_process_tree_rss_bytes":268435456}]}